,company,description,location,salary,title
789,International WELL Building Institute,Work with data warehouse and propose data schema and data flow optimization for reporting performance and enhancement as needed.,New York State,,Business Intelligence (BI) Developer
790,ASC,"3+ years of experience in data/business/technical analysis,. • 3+ years of experience in data/business/technical analysis. • BA in computer Science or IT.","Pennington, NJ",,Remote Data Analyst (Machine Learning/ETL/SQL/CMDB/Flexera/BDNA/Bank)
791,Inspire,Analyze data to provide new insights or data points for further analysis. Ability to work with text data for analysis and creation of new data points.,Remote,,Data Analyst
792,Priority Health,Provides technical expertise and applies critical thinking skills to develop data solutions that solve the needs of the data science team.,Remote,,Senior Data Engineer
793,Continental AG,Work up and present results with due regard to a different knowledge of stakeholder groups and leading data science projects.,"Fort Mill, SC",,Data Scientist
794,BeiGene,Analytical - Synthesizes complex or diverse information; Collects and researches data; Uses intuition and experience to complement data.,Remote,,"Associate Director, Data Science and Operational Excellence"
795,US National Geospatial-Intelligence Agency,"Data analysis techniques (e.g., data mining and retrieval); Effective data management, data dissemination, and online on-demand practices.","Arnold, MO","$65,597 - $134,798 a year",Data Scientist
796,GovernmentCIO LLC,"In this role you will directly support a Chief Data Scientist team lead, working alongside analytics and data science professionals.",Remote,,Data Analyst
797,Syngenta,Experience applying data science in a scientific/R&D environment. Collaborate with data engineers to leverage Syngenta’s unique portfolio of diverse data assets…,"Durham, NC",,Data Scientist
798,MarketCast,"At least a Bachelor’s degree in the Social Sciences, Economics, Business, Marketing, Statistics, or related fields. A pretty good handle on Microsoft Office.","New York, NY +1 location",,"Analyst, Custom Research."
799,"Big Data Federation, Inc.",Develop data science infrastructure tooling such as proprietary R packages. Collaborate with researchers to provide insights in data.,"Santa Clara, CA",,Senior Data Scientist
800,Capgemini,"The consultant should have thorough experience in migrating data from local shared drives to BOX Cloud, including mirroring permissions.","New York, NY",,Data Migration Resource
801,Sysvine Technologies Pvt Ltd,"Work closely with a data science team implementing data analytic pipelines. Work on ingesting, storing, processing and analyzing large data sets create scalable…","New York, NY","$65,267 - $90,000 a year",REQ/366 Big Data Engineer
802,Excella,"Demonstrate understanding of relational databases, data architecture, and data modeling. Able to operationalize business questions using data.","Arlington, VA","$100,000 - $135,000 a year",Sr. Data Analyst
803,Vanguard,"Oversees a team of advanced data analysts responsible for a portfolio of strategic data projects that involve gathering data, verifying its accuracy and…","Malvern, PA",,Data Science Manager
804,Micron Technology,"Experience building and optimizing ‘big data’ data pipelines, architectures and data sets. Work with data and analytics experts to strive for greater…","Manassas, VA",,Data Engineer286753
805,"Stefanini, Inc",Build business cases for data science applications through collaboration with business leaders and subject matter experts.,"Greensboro, NC","$117,000 - $122,000 a year",Data Scientist/Data Engineer
806,Kagr Llc,Maintain and document work associated with analyses and data science products. Collect and process data to perform statistical analyses.,"Foxborough, MA",,Analyst - Data Science
807,Eurofins USA BioPharma Services,"Ensure that the client receives quality data by reviewing laboratory data for accuracy, clarity, and adherence to GMP and/or GLP regulations.","Lancaster, PA",,Associate Data Review Scientist-Molecular and Cell Biology
808,Advance Auto Parts,Minimum of 2 years of work experience in a data science related. Provide guidance and recommendations to leadership team in areas of analytics and data science.,"Raleigh, NC",,Data Scientist
809,Motion2AI,"Machine learning engineers and researchers (full-time & internship). Motion2AI provides warehouse fleet orchestration services for forklifts, carts, and robots.","Mountain View, CA",,Machine Learning Engineer / Researcher
810,Inspire11,"Extract data from multiple sources, integrate disparate data into a common data model, and integrate data into a target database, application, or file using…","Atlanta, GA +1 location",,Data Engineer
811,"BigBear, Inc.","BigBear.ai provides a comprehensive suite of solutions including artificial intelligence and machine learning, data science, advanced analytics, offensive and…","San Diego, CA +1 location","$175,000 - $240,000 a year",Vice President of Product (Artificial Intelligence/Machine Learning)
812,Kaplan,"At least 1 year of research/data analysis experience. Conduct cluster analyses of internal data to segment customers and leads. SQL, R/Python, Microsoft Office.",Remote,$15 an hour,"Data Analyst, Customer Insights"
813,Google,"3 years of experience working in an analytical capacity in a management consulting, investment banking, business intelligence, data science, or corporate…","Mountain View, CA",,"Product and Business Strategy Lead, Analytics"
814,Instacart,"As the Senior Manager of Data Science for Growth, you will hire and build the data science team that oversees all data, analytics, experiments and insights…",California,,"Senior Manager, Data Science - Growth"
815,Worthwhile,"The Data Engineer will also be responsible for data architecture that defines data models for new systems, selecting the best data storage solution for a given…",Remote,"$70,000 - $90,000 a year",Data Engineer
816,Airtable,"Work between our engineering organization and stakeholders from our data science, growth, sales, marketing, and product teams, to understand the data needs of…","San Francisco, CA",,Data Engineer
817,Øptimus Consulting,"Øptimus Consulting, a data science and software company, is seeking a full-time associate data scientist in their Washington D.C. area office.","Alexandria, VA",,Associate Data Scientist
818,Ennuviz,Insight into how the operational realities of data science can be better managed and accelerated. Incorporated local data caches for pre-population of features…,Remote,,Data Scientist
819,Tuknik Government Services,The Statistician identifies methodologies and measures for assessment and summarization of findings Selects appropriate statistical and epidemiologic techniques…,"College Park, MD",,Statistician
820,Valley Agricultural Software Inc,"Solid understanding of data science, machine learning and artificial intelligence. At least four years of working experience in a (senior) data science position…",Remote,,Senior Director of Data Science
821,Mitre Corporation,"BS or MS in analytics, data science, policy, engineering, or math field. Analysis of aviation safety and certification data to determine trends.","McLean, VA",,Associate Policy Risk & Data Analyst
822,AvantStay,"Working knowledge of big data manipulation is plus. Design and drive the creation of new standards and best practices in the use of statistical data modeling,…",Remote,"$80,000 - $100,000 a year",Data Scientist
823,Hulu,"Apply advanced analytics techniques (data mining, data visualization, statistical analysis, machine learning) on large-scale, high-dimensional data to help…","Santa Monica, CA",,"Data Analyst - Advanced Analytics, Content"
824,North Carolina State University,"Bachelor’s degree and/or advanced certification in computer science, data science, or similar technical field; or 4 years of experience using software for data…","Raleigh, NC","$70,000 - $82,000 a year",Data Analyst and Visualization Specialist
825,Presbyterian Healthcare Services,"Provide support in creating/coding, designing and testing pilot data-driven predictive/descriptive analytical models. Health plan: 2 years (Preferred).",United States,"$79,000 - $120,000 a year",Data Scientist - HEDIS - REMOTE
826,Cape Analytics,"Founded in 2014, Cape Analytics is backed by leading venture firms and innovative insurers and is comprised of computer vision, data science, and risk analysis…",Remote,,Business Analyst
827,ClinChoice Inc,"Develop SAS programmable edit checks to assist data monitoring, document and report data issue to Data Management with minimum supervision.","Fort Washington, PA",,Statistical Programmer/Analyst
828,"Cass Information Systems, Inc.","A technical level of knowledge normally acquired through completion of a bachelor’s degree in computer science, data science, or related area, or equivalent…","Jacksonville, FL",,Business Intelligence Developer
829,Atlas One,"Passion for high data quality and scaling data science work. Become a data expert in your business domain and own data quality. Within 6 Months, You'll:",California,,AI/ML Data Scientist Engineer
830,LATOKEN,"Burnouts : Detect burnouts before they get toxic with big data of OKRs, checklists and 360. LATOKEN is a top blockchain bet on the financial system upgrade.",Remote,,Head of Analytics
831,LPL Financial,"Partner with Technology on foundational data quality improvement and infrastructure, including the incorporation of new data sources and development of data…","Fort Mill, SC",,"SVP, Enterprise Data & Analytics"
832,Ampersand,The ideal candidate has extensive experience developing data intensive software as part of a data science or machine learning engineering group.,"New York, NY",,Associate Data Scientist
833,Gemini,"1-3 years experience with data analysis & exploration. Data analytics tools (Python pandas, R, or similar). Produce metrics to track the performance of the team…","New York, NY",,"Data Scientist; Trust & Safety, Data Intelligence"
834,Facebook,"Collaborate with software engineers, product managers, other data engineers and data scientists to understand data needs.","Bellevue, WA +2 locations",,"Return to Work - Data Engineer, Analytics"
835,New York Genome Center,"Analyze sequencing data using established pipelines; Demonstrated exposure to NGS data analysis; MS degree in bioinformatics, computer science or equivalent…","New York, NY",,"Data Science Associate, Landau Lab"
836,SS&C Technologies,"Work collaboratively with our outsourcing service teams to define data strategy, identify critical data elements, and create data governance on those critical…","New York, NY",,Data Scientist
837,"HK Consulting, Inc.","Problem-solving with product and business teams, advise executive team how to leverage data science across the company. Data science: 3 years (Required).",Remote,"$150,000 - $220,000 a year",Director of Business Analytics & Data Science - Remote within US
838,competitive balance analytics,Candidate must be experienced developing robust data processing and prediction solutions for production level applications.,Remote,"$110,000 - $140,000 a year",Senior Data Scientist
839,Pinterest,"We're looking for a software engineer with experience in ads delivery, conversion optimization, machine learning, automatic bidding and pacing to develop new…","San Francisco, CA",,"Machine Learning Engineer, Ads Ranking"
840,NYC Data Science Academy,"Opportunity to train, research, and learn in the field of data science on-the-job; a chance to interact with active data science communities through conferences…","New York, NY",,Data Science Instructor-Machine Learning (Full-Time)
841,Gro Intelligence Careers,3+ years of relevant data science / research experience. Experience / Interest in climate data or climate science. Familiarity with time series analysis.,"New York, NY",,Climate Change Impact Data Scientist / Analyst
842,Fannie Mae,"Serve as a thought leader in the data and data sciences architecture space through consistent research and practice; bridge outside, industry best practices…","Washington, DC",,"Fellow, Data & Data Science Architecture"
843,SCRRA/Metrolink,Must demonstrate the ability to collect and analyze data efficiently and work within established timelines. Assists with reviewing projects to identify critical…,"Los Angeles, CA","$55,778 - $87,161 a year",Management Analyst I
844,Cisco Systems,Project Leads large scale data projects to support organizational. As a Program Manager your core responsibility will be acquiring benchmark data related to our…,"Research Triangle Park, NC",,"Program Manager, WPR"
845,WINFertility,Proficiency in data visualization tools including Tableau. Build new data architecture that interfaces with WIN’s proprietary systems and with publicly…,"Greenwich, CT",,Senior Data Analyst
846,NYU Langone,Design and conduct analyses pertaining to data acquired thorough various data sources. Create descriptive data summaries including visualizations and written…,"New York, NY",,Data Analyst
847,"IntelliGenesis, LLC","Our benefits include: Medical, Dental and Vision Insurance, 25 days of PTO with the option to purchase up to an additional 5 days, 12 paid holidays, up to 10%…","Augusta, GA +1 location",,Intelligence Analyst Talent Community
848,Aquant,Assist Customer Success Managers in the labeling of our customers’ data. ﻿A recent graduate with experience working with data and tech.,"New York, NY",,Data Quality Specialist
849,Institute for Defense Analyses,"Masters degree in STEM field plus military experience in logistics, supply, maintenance and data science skills.","Alexandria, VA",,Research Analyst - Readiness Analysis
850,Publicis Groupe,Analytics and data science techniques that will be used to turn data into actions. Use APIs to import and push data across various systems.,"Miami, FL",,Senior Data Analyst
851,LRW,Writing code to build data products currently in the queue. Engage in R&D to build data products that can address new and unique business questions or shed…,"Los Angeles, CA",,Machine Learning Engineer
852,Gryphon Technologies,Experience in ingesting data with querying languages (eg. PL/SQL) into data warehouse and converting databases into a data warehouse.,Remote,,Junior Data Scientist
853,ModivCare,Good data visualization and communication skills. This will include preparing and delivering presentations with rich data visualizations and meaningful business…,California,"$78,692 - $132,728 a year",Data Scientist
854,CapB InfoteK,"A. Validate quality of input data and output results of models/solutions; C. Validate the entire pipeline including: data ingestion, feature engineering, model…","Miami, FL",,Data Science QA
855,Facebook,"Apply your expertise in quantitative analysis, data mining, and the presentation of data to see beyond the numbers and understand how our users and Public…",Remote +2 locations,,"Data Scientist, Analytics - Emerging Business"
856,Adobe,"Adobe is seeking an upbeat, high-EQ senior attorney to join the Data/Design Legal Team and provide legal advice to Adobe’s innovative technology and research…","San Jose, CA",,Senior Legal Counsel - Data/Design
857,Progressive,Advanced programming experience in programming languages used in analytics and data science (e.g. Python). As a Data Engineering Lead or Consultant on the Data…,"Mayfield Village, OH","$97,900 - $126,700 a year",Data Engineer Lead or Consultant - Remote
858,Delta,The candidate will have expertise in implementing and developing data science IT solutions. How Youll Help Us Keep Climbing (overview and key responsibilities):…,"Atlanta, GA",,"Sr. Project Manager, Decision Science"
859,Enigma,Have experience combining diverse sets of data at scale. Exploring new data sets and extracting the signal that powers our products.,New York State,,Data Scientist
860,Blue and Company,"2+ years’ experience as a data analyst, business analyst, or data report writer required. Provide recommendations for data strategy and organization.","Louisville, KY",,BI Analyst
861,Los Angeles Homeless Services Authority,"Practiced experience in collecting primary data, utilizing secondary data, as well as organizing and managing administrative data.","Los Angeles, CA","$58,240 - $76,638 a year","Analyst, Data & Research"
862,Continental AG,"Analyze large data sets on high performance cloud environment. As a data scientist you will work closely with data and software engineers, field intelligence…","Fort Mill, SC",,Data Scientist - Fleet Services
863,Jackson Lewis P.C,"At least 8 years’ experience in data analytics or data science roles including 5 years’ experience leading a high performing, collaborative data analytics team.","New York, NY","$150,000 - $200,000 a year",Director of Data Analytics
864,Tradesy,4-8 years experience in an analytics or data related role. Experience with SQL and large data sets (terabyte scale) is a mus t.,California,,Senior Data Analyst
865,Dandy,Dandy's data program is newly led by a team with a proven track record of building data practices at hypergrowth companies. Direct experience in Data Analytics.,"New York, NY",,Data Analyst
866,"Iridium Satellite, LLC","Respond to internal data inquiries. Demonstrates proficiency in developing, tuning, and executing efficient data queries from a variety of sources (databases…","Chandler, AZ",,Data Scientist
867,Consumers' Checkbook/Center for the Study of Services,"3+ years data management, including multiple data sources which refresh frequently. Experience with analysis and summary of health insurance markets, plan data,…","Washington, DC",$48 - $74 an hour,Senior Health Data Scientist
868,Association of Immunization Managers,Master’s Degree (preferred) or Bachelor’s Degree in public health; data science; medical; healthcare (or similar) informatics; computer science; epidemiology;…,Remote,"$72,000 a year",Data Project Manager
869,Afiniti,"Responsible to create stored procedures and scripts, reconcile data, ensure data integrity, define data joining procedures, and performing statistical trend…","Washington, DC",,"Associate, Data Analytics"
870,Facebook,"These data operations include operations supporting labeling for machine learning, data annotation for product development, data collection for new hardware…","Sunnyvale, CA",,"Director, Product Data Operations, AI"
871,Booz Allen Hamilton,"Participate in partnerships with data science leaders, like our partnership with NVIDIA to deliver Deep Learning Institute (DLI) training to the federal…","Washington, DC",,"Fraud Data Analytics Specialist, Mid"
872,Day & Zimmermann - Corporate TA,Responsible for advanced analytical capabilities in support of D&Z data science initiatives. Responsible for applying advanced statistical concepts to analyze…,"Philadelphia, PA",,Data Scientist 2
873,kraken,"Experience applying data science techniques and knowledge, and building data science products. 12 or more years of experience within data analytics and data…",Remote,,Director of Data
874,Google,"Relevant professional experience with applied data analytics and predictive modeling. We're looking for engineers who bring fresh ideas from all areas,…","Atlanta, GA",,"Software Engineer III, Machine Learning"
875,US Equal Employment Opportunity Commission,"Evaluates the data, draws inferences and arrives at conclusions to create most effective presentation. Assures that the office supports the publishing of…","Washington, DC","$87,198 - $134,798 a year",Statistician
876,iknowvate technologies,"Python, SQL, Tableau, data science experience. Bachelor's degree in Computer science or equivalent, with minimum 8+ Years of relevant experience.","Philadelphia, PA",,"Data Scientist - Philadelphia, PA(Remote)"
877,Certified Collectibles Group,"Comfortable suggesting and implementing data pipeline changes. Comfortable dealing with disparate, unstructured, multilingual data sources.","Sarasota, FL",,Data Scientist (Highly Competitive Salary)
878,Barbaricum,"Build data solutions, tools, and capabilities to enable self-service frameworks for data consumers to monitor and report on data. Active DoD TS/SCI clearance.","Virginia Beach, VA",,Data Scientist – Naval Special Warfare
879,Spotify,"Communicate data-driven insights and recommendations to non-technical audiences, through clear visualizations and data storytelling.","New York, NY +1 location",,"Data Scientist, Music Analytics"
880,CircleUp,"Experience selling a data product, ideally within CPG or financial markets. CircleUp is bringing the data-driven revolution that occurred in the public markets…","San Francisco, CA",,"Head of Business Development & Partnerships, Insights"
881,TELUS International,HR manager will oversee all aspects of Human Resources practices and processes. HR Manager will support business needs and ensure the proper implementation of…,Remote,,"HR Manager, Artificial Intelligence"
882,Prudential,Experience working with senior leaders to educate on data and data science capabilities and how to leverage them to solve complex business problems.,"Newark, NJ",,"Vice President, Strategy, Innovation, & Data Science"
883,James River Insurance Company,Conduct ongoing audits of data in all HR systems to ensure data integrity. Ensure data integrity of all HR systems’ data; identify and resolve errors and issues…,Remote +1 location,,Senior HR Data Analyst
884,Dascena,Passionate about applying data science to positively impact healthcare. Bachelor’s degree in a quantitative science or related field.,Remote,,Strategy Analyst
885,Prudential,"Bachelor's degree in computer science, data science, mathematics, or a related field. Work with architecture, data, and design teams to assist with data related…",Remote,,Machine Learning Engineer
886,Spotify,"You should have strong experimentation, metric & data creation, and data visualization skills as well as possess excellent communication skills to interface…","New York, NY",,"Data Scientist, Podcaster Mission"
887,BTAS,"Apply data to develop and provide analytical support to all levels of management. Create, develop, and/or apply existing tools and techniques to conduct data…","Langley AFB, VA",,Junior Data Scientist - Future
888,Cornerstone,"We are looking for a scrappy, hunter, with a 2-3 years of experience selling data movement, analytics, data science or similar SAAS solutions into mid -market…",Remote,,Mid Market Account Executive - AI/ ML / Data science Analytics
889,TechnoServe,"This will require a deep understanding of data structure, data processing, and software functions to support data flow and interoperability between systems.","Arlington, VA",,Data Scientist
890,Helm LLC,Prior application of data and reporting integrity and sustainability. Minimum of five years’ experience working with structured and non-structured data to…,Remote,,Data Scientist
891,CBRE,"Familiarity with data science techniques. A master’s degree and in economics, data science, statistics or related, PhD preferred.","Atlanta, GA",,Office Economist
892,"Scuttlebutt Services, LLC",Generating representative data sets for systems development and data science initiatives. 4+ years of experience designing data models and data warehouses…,"Chantilly, VA","$180,000 - $200,000 a year",Data Engineer
893,Sendle,Work with business intelligence and data engineering to design and develop data infrastructure to support partnerships evolution and growth.,Washington State +1 location,,"Data Analyst, Partnerships"
894,L3Harris Technologies,Work within a research team to develop creative and innovative interfaces for complex analytical data produced by machine learning and artificial intelligence…,"Wright-Patterson AFB, OH",,Artificial Intelligence (AI) Researcher
895,Pricesenz,"This position develops, tests, and maintains scalable and efficient data pipelines to acquire and transform large volumes of structured and unstructured data,…","Petersburg, VA",,Senior Data Engineer
896,Applied Information Sciences,"Design scalable data processing and analytics solutions, including Big data storage for various data types and large-scale data processing using Databricks.","Reston, VA",,Data Architect
897,Webstore Group,Develop custom data models and algorithms to apply to data sets. Assess the effectiveness and accuracy of new data sources and data gathering techniques.,"Tamarac, FL",,Data Scientist
898,Facebook,"Experience manipulating large data sets in SQL or equivalent, and drawing actionable insights from data. We partner closely with several cross-functional teams,…","Seattle, WA",,"Commerce Enforcement Analyst, Rule Writing"
899,Oak Ridge National Laboratory,"We accomplish this mission by conducting fundamental research in quantum computer science, developing and benchmarking quantum algorithms for scientific…","Oak Ridge, TN",,R&D Associate in Quantum Machine Learning
900,Panasonic Corporation of North America,Experience with visualizing data (e.g. data dashboards). You will work in a small team of data science and algorithm engineers to expand our internal and…,"Palo Alto, CA",,Data Engineer
901,Bossier Parish Community College,"Perform exploratory data analysis and visualization to get a better appreciation of the data. Minimum 3 years work experience in institutional research,…","Bossier City, LA",,Data Analyst Specialist
902,"Denali System Co., Ltd",Data science: 1 year (Preferred). Proven Experience in working with large scale data systems. Familiar with commonly used data analysis methods and very good…,"Mountain View, CA",,"Data Scientist -- Full-time, entry level"
